Ticker,Name
BTCQ.TO,3iQ Bitcoin ETF
ETHQ.TO,3iQ Ether Staking ETF
VNP.TO,5N Plus Inc.
AAB.TO,Aberdeen International Inc.
FAP.TO,abrdn Asia-Pacific Income Fund VCC
ADN.TO,Acadian Timber Corp.
HDGE.TO,Accelerate Absolute Return Fund
ARB.TO,Accelerate Arbitrage Fund
ATSX.TO,Accelerate Canadian Long Short Equity Fund
ONEC.TO,Accelerate OneChoice Alternative Portfolio ETF
ACD.TO,Accord Financial Corp.
ARA.TO,Aclara Resources Inc.
ADCO.TO,Adcore Inc.
ADEN.TO,ADENTRA Inc.
DRX.TO,ADF Group Inc.
AAV.TO,Advantage Energy Ltd.
ARE.TO,Aecon Group Inc.
AEG.TO,Aegis Brands Inc.
AEZS.TO,AEterna Zentaris Inc.
AOI.TO,Africa Oil Corp.
AFN.TO,Ag Growth International Inc.
QCD.TO,AGF Systematic Canadian Equity ETF
QEM.TO,AGF Systematic Emerging Markets Equity ETF
QIE.TO,AGF Systematic International Equity ETF
QUS.TO,AGF Systematic US Equity ETF
QBTL.TO,AGF US Market Neutral Anti-Beta CAD-Hedged ETF
AEM.TO,Agnico Eagle Mines Limited
AIM.TO,Aimia Inc.
AC.TO,Air Canada
BOS.TO,AirBoss of America Corp.
AGI.TO,Alamos Gold Inc.
ALC.TO,Algoma Central Corporation
ASTL.TO,Algoma Steel Group Inc.
AQN.TO,Algonquin Power & Utilities Corp.
ATD.TO,Alimentation Couche-Tard Inc.
ALYA.TO,Alithya Group inc.
AAUC.TO,Allied Gold Corporation
AMM.TO,Almaden Minerals Ltd.
AII.TO,Almonty Industries Inc.
ATCU.TO,Alta Copper Corp.
ALA.TO,AltaGas Ltd.
ALS.TO,Altius Minerals Corporation
ARR.TO,Altius Renewable Royalties Corp.
AIF.TO,Altus Group Limited
USA.TO,Americas Gold and Silver Corporation
ARG.TO,Amerigo Resources Ltd.
ANRG.TO,Anaergia Inc.
AND.TO,Andlauer Healthcare Group Inc.
ATE.TO,Antibe Therapeutics Inc.
APLI.TO,Appili Therapeutics Inc.
APS.TO,Aptose Biosciences Inc.
ARX.TO,ARC Resources Ltd.
AR.TO,Argonaut Gold Inc.
ARIS.TO,Aris Mining Corporation
ATZ.TO,Aritzia Inc.
AMC.TO,Arizona Metals Corp.
ASCU.TO,Arizona Sonoran Copper Company Inc.
ADIV.TO,Arrow EC Equity Advantage Alternative Fund
RATE.TO,Arrow EC Income Advantage Alternative Fund
ACAA.TO,Arrow Long/Short Alternative Class
ASND.TO,Ascendant Resources Inc.
AOT.TO,Ascot Resources Ltd.
ATH.TO,Athabasca Oil Corporation
AI.TO,Atrium Mortgage Investment Corporation
ATS.TO,ATS Corporation
G.TO,Augusta Gold Corp.
ORA.TO,Aura Minerals Inc.
ACB.TO,Aurora Cannabis Inc.
ACQ.TO,AutoCanada Inc.
XLY.TO,Auxly Cannabis Group Inc.
AVL.TO,Avalon Advanced Materials Inc.
AVNT.TO,Avant Brands Inc.
AVCN.TO,Avicanna Inc.
ASM.TO,Avino Silver & Gold Mines Ltd.
AXIS.TO,Axis Auto Finance Inc.
AYA.TO,Aya Gold & Silver Inc.
BTO.TO,B2Gold Corp.
BDGI.TO,Badger Infrastructure Solutions Ltd.
BLDP.TO,Ballard Power Systems Inc.
BMO.TO,Bank of Montreal
BNS.TO,Bank of Nova Scotia (The)
ABX.TO,Barrick Gold Corporation
BLCO.TO,Bausch + Lomb Corporation
BHC.TO,Bausch Health Companies Inc.
BYL.TO,Baylin Technologies Inc.
BTE.TO,Baytex Energy Corp.
BCE.TO,BCE Inc.
BSX.TO,Belo Sun Mining Corp.
BNG.TO,Bengal Energy Ltd.
HGD.TO,BetaPro Canadian Gold Miners -2x Daily Bear ETF
HGU.TO,BetaPro Canadian Gold Miners 2x Daily Bull ETF
HOD.TO,BetaPro Crude Oil Inverse Leveraged Daily Bear ETF
HOU.TO,BetaPro Crude Oil Leveraged Daily Bull ETF
HBKD.TO,BetaPro Equal Weight Canadian Bank -2x Daily Bear ETF
HBKU.TO,BetaPro Equal Weight Canadian Bank 2x Daily Bull ETF
HRED.TO,BetaPro Equal Weight Canadian REIT -2x Daily Bear ETF
HREU.TO,BetaPro Equal Weight Canadian REIT 2x Daily Bull ETF
HBD.TO,BetaPro Gold Bullion -2x Daily Bear ETF
HBU.TO,BetaPro Gold Bullion 2x Daily Bull ETF
BITI.TO,BetaPro Inverse Bitcoin ETF
HQD.TO,BetaPro NASDAQ-100 -2x Daily Bear ETF
HQU.TO,BetaPro NASDAQ-100 2x Daily Bull ETF
HND.TO,BetaPro Natural Gas Inverse Leveraged Daily Bear ETF
HNU.TO,BetaPro Natural Gas Leveraged Daily Bull ETF
HSD.TO,BetaPro S&P 500 -2x Daily Bear ETF
HSU.TO,BetaPro S&P 500 2x Daily Bull ETF
HIU.TO,BetaPro S&P 500 Daily Inverse ETF
HUV.TO,BetaPro S&P 500 VIX Short-Term Futures ETF
HXD.TO,BetaPro S&P/TSX 60 -2x Daily Bear ETF
HXU.TO,BetaPro S&P/TSX 60 2x Daily Bull ETF
HIX.TO,BetaPro S&P/TSX 60 Daily Inverse ETF
HED.TO,BetaPro S&P/TSX Capped Energy -2x Daily Bear ETF
HEU.TO,BetaPro S&P/TSX Capped Energy 2x Daily Bull ETF
HFD.TO,BetaPro S&P/TSX Capped Financials -2x Daily Bear ETF
HFU.TO,BetaPro S&P/TSX Capped Financials 2x Daily Bull ETF
HZD.TO,BetaPro Silver -2x Daily Bear ETF
HZU.TO,BetaPro Silver 2x Daily Bull ETF
BNK.TO,Big Banc Split Corp.
PRM.TO,Big Pharma Split Corp.
BR.TO,Big Rock Brewery Inc.
BIR.TO,Birchcliff Energy Ltd.
BDT.TO,Bird Construction Inc.
EBIT.TO,Bitcoin ETF
QBTC.TO,"Bitcoin Fund, The"
BITF.TO,Bitfarms Ltd.
BDI.TO,Black Diamond Group Limited
BKI.TO,Black Iron Inc.
BB.TO,BlackBerry Limited
BLN.TO,Blackline Safety Corp.
HBLK.TO,Blockchain Technologies ETF
ZAG.TO,BMO Aggregate Bond Index ETF
ZEQT.TO,BMO All-Equity ETF
ARKG.TO,BMO ARK Genomic Revolution Fund
ARKK.TO,BMO ARK Innovation Fund
ARKW.TO,BMO ARK Next Generation Internet Fund
ZESG.TO,BMO Balanced ESG ETF
ZBAL.TO,BMO Balanced ETF
ZBBB.TO,BMO BBB Corporate Bond Index ETF
TOWR.TO,BMO Brookfield Global Real Estate Tech Fund
GRNI.TO,BMO Brookfield Global Renewables Infrastructure Fund
ZBI.TO,BMO Canadian Bank Income Index ETF
ZDV.TO,BMO Canadian Dividend ETF
ZWC.TO,BMO Canadian High Dividend Covered Call ETF
ZMBS.TO,BMO Canadian MBS Index ETF
ZCLN.TO,BMO Clean Energy Index ETF
ZCON.TO,BMO Conservative ETF
ZCPB.TO,BMO Core Plus Bond Fund
ZCB.TO,BMO Corporate Bond Index ETF
ZCDB.TO,BMO Corporate Discount Bond ETF
ZWB.TO,BMO Covered Call Canadian Banks ETF
ZWA.TO,BMO Covered Call Dow Jones Industrial Average Hedged to CAD ETF
ZWEN.TO,BMO Covered Call Energy ETF
ZWHC.TO,BMO Covered Call Health Care ETF
ZWT.TO,BMO Covered Call Technology ETF
ZWK.TO,BMO Covered Call US Banks ETF
ZWU.TO,BMO Covered Call Utilities ETF
ZDB.TO,BMO Discount Bond Index ETF
ZDJ.TO,BMO Dow Jones Industrial Average Hedged to CAD Index ETF
ZEF.TO,BMO Emerging Markets Bond Hedged to CAD Index ETF
ZEB.TO,BMO Equal Weight Banks Index ETF
ZMT.TO,BMO Equal Weight Global Base Metals Hedged to CAD Index ETF
ZGD.TO,BMO Equal Weight Global Gold Index ETF
ZIN.TO,BMO Equal Weight Industrials Index ETF
ZEO.TO,BMO Equal Weight Oil & Gas Index ETF
ZRE.TO,BMO Equal Weight REITs Index ETF
ZUB.TO,BMO Equal Weight US Banks Hedged to CAD Index ETF
ZBK.TO,BMO Equal Weight US Banks Index ETF
ZUH.TO,BMO Equal Weight US Health Care Hedged to CAD Index ETF
ZHU.TO,BMO Equal Weight US Health Care Index ETF
ZUT.TO,BMO Equal Weight Utilities Index ETF
ESGB.TO,BMO ESG Corporate Bond Index ETF
ESGH.TO,BMO ESG High Yield US Corporate Bond Index ETF
ESGF.TO,BMO ESG US Corporate Bond Hedged to CAD Index ETF
ZWP.TO,BMO Europe High Dividend Covered Call ETF
ZWE.TO,BMO Europe High Dividend Covered Call Hedged to CAD ETF
ZFH.TO,BMO Floating Rate High Yield ETF
ZEAT.TO,BMO Global Agriculture ETF
COMM.TO,BMO Global Communications Index ETF
DISC.TO,BMO Global Consumer Discretionary Hedged to CAD Index ETF
STPL.TO,BMO Global Consumer Staples Hedged to CAD Index ETF
ZWQT.TO,BMO Global Enhanced Income Fund
ZWG.TO,BMO Global High Dividend Covered Call ETF
ZGI.TO,BMO Global Infrastructure Index ETF
ZGSB.TO,BMO Global Strategic Bond Fund
ZGLD.TO,BMO Gold Bullion ETF
ZGLH.TO,BMO Gold Bullion Hedged to CAD ETF
ZGB.TO,BMO Government Bond Index ETF
ZGRO.TO,BMO Growth ETF
ZQB.TO,BMO High Quality Corporate Bond Index ETF
ZHY.TO,BMO High Yield US Corporate Bond Hedged to CAD Index ETF
ZJK.TO,BMO High Yield US Corporate Bond Index ETF
ZDI.TO,BMO International Dividend ETF
ZDH.TO,BMO International Dividend Hedged to CAD ETF
ZJPN.TO,BMO Japan Index ETF
ZJG.TO,BMO Junior Gold Index ETF
ZPR.TO,BMO Laddered Preferred Share Index ETF
ZLC.TO,BMO Long Corporate Bond Index ETF
ZFL.TO,BMO Long Federal Bond Index ETF
ZPL.TO,BMO Long Provincial Bond Index ETF
ZLSC.TO,BMO Long Short Canadian Equity ETF
ZLSU.TO,BMO Long Short US Equity ETF
ZLB.TO,BMO Low Volatility Canadian Equity ETF
ZLE.TO,BMO Low Volatility Emerging Markets Equity ETF
ZLI.TO,BMO Low Volatility International Equity ETF
ZLD.TO,BMO Low Volatility International Equity Hedged to CAD ETF
ZLU.TO,BMO Low Volatility US Equity ETF
ZLH.TO,BMO Low Volatility US Equity Hedged to CAD ETF
ZCM.TO,BMO Mid Corporate Bond Index ETF
ZFM.TO,BMO Mid Federal Bond Index ETF
ZMP.TO,BMO Mid Provincial Bond Index ETF
ZMU.TO,BMO Mid-Term US IG Corporate Bond Hedged to CAD Index ETF
ZIC.TO,BMO Mid-Term US IG Corporate Bond Index ETF
ZMMK.TO,BMO Money Market Fund
ZMI.TO,BMO Monthly Income ETF
ZGRN.TO,BMO MSCI ACWI Paris Aligned Climate Equity Index ETF
ZGQ.TO,BMO MSCI All Country World High Quality Index ETF
ESGA.TO,BMO MSCI Canada ESG Leaders Index ETF
ZVC.TO,BMO MSCI Canada Value Index ETF
ZCH.TO,BMO MSCI China ESG Leaders Index ETF
ESGE.TO,BMO MSCI EAFE ESG Leaders Index ETF
ZDM.TO,BMO MSCI EAFE Hedged to CAD Index ETF
ZEA.TO,BMO MSCI EAFE Index ETF
ZEM.TO,BMO MSCI Emerging Markets Index ETF
ZEQ.TO,BMO MSCI Europe High Quality Hedged to CAD Index ETF
ESGG.TO,BMO MSCI Global ESG Leaders Index ETF
ZID.TO,BMO MSCI India ESG Leaders Index ETF
ESGY.TO,BMO MSCI USA ESG Leaders Index ETF
ZUQ.TO,BMO MSCI USA High Quality Index ETF
ZVU.TO,BMO MSCI USA Value Index ETF
ZQQ.TO,BMO Nasdaq 100 Equity Hedged To CAD Index ETF
ZNQ.TO,BMO Nasdaq 100 Equity Index ETF
ZPAY.TO,BMO Premium Yield ETF
ZRR.TO,BMO Real Return Bond Index ETF
ZUE.TO,BMO S&P 500 Hedged to CAD Index ETF
ZSP.TO,BMO S&P 500 Index ETF
ZMID.TO,BMO S&P US Mid Cap Index ETF
ZSML.TO,BMO S&P US Small Cap Index ETF
ZIU.TO,BMO S&P/TSX 60 Index ETF
ZCN.TO,BMO S&P/TSX Capped Composite Index ETF
ZCS.TO,BMO Short Corporate Bond Index ETF
ZFS.TO,BMO Short Federal Bond Index ETF
ZPS.TO,BMO Short Provincial Bond Index ETF
ZSB.TO,BMO Short-Term Bond Index ETF
ZSDB.TO,BMO Short-Term Discount Bond ETF
ZSU.TO,BMO Short-Term US IG Corporate Bond Hedged to CAD Index ETF
ZTIP.TO,BMO Short-Term US TIPS Index ETF
ZFC.TO,BMO SIA Focused Canadian Equity Fund
ZFN.TO,BMO SIA Focused North American Equity Fund
ZMSB.TO,BMO Sustainable Global Multi-Sector Bond Fund
ZZZD.TO,BMO Tactical Dividend ETF Fund
ZACE.TO,BMO U.S. All Cap Equity Fund
ZUGE.TO,BMO U.S. Equity Growth MFR Fund
ZUVE.TO,BMO U.S. Equity Value MFR Fund
ZST.TO,BMO Ultra Short-Term Bond ETF
ZUAG.TO,BMO US Aggregate Bond Index ETF
ZDY.TO,BMO US Dividend ETF
ZUD.TO,BMO US Dividend Hedged to CAD ETF
ZWH.TO,BMO US High Dividend Covered Call ETF
ZWS.TO,BMO US High Dividend Covered Call Hedged to CAD ETF
ZHP.TO,BMO US Preferred Share Hedged to CAD Index ETF
ZUP.TO,BMO US Preferred Share Index ETF
ZPW.TO,BMO US Put Write ETF
ZPH.TO,BMO US Put Write Hedged to CAD ETF
TIPS.TO,BMO US TIPS Index ETF
ZUCM.TO,BMO USD Cash Management ETF
WOMN.TO,BMO Women in Leadership Fund
GBT.TO,BMTC Group Inc.
BRMI.TO,Boat Rocker Media Inc.
BNE.TO,Bonterra Energy Corp.
BLX.TO,Boralex Inc.
BYD.TO,Boyd Group Services Inc.
BRAG.TO,Bragg Gaming Group Inc.
BRY.TO,Bri-Chem Corp.
BCT.TO,BriaCell Therapeutics Corp.
BRE.TO,Bridgemarq Real Estate Services Inc.
BGC.TO,Bristol Gate Concentrated Canadian Equity ETF
BGU.TO,Bristol Gate Concentrated US Equity ETF
ESP.TO,Brompton Energy Split Corp.
BMAX.TO,Brompton Enhanced Multi-Asset Income ETF
EDGF.TO,Brompton European Dividend Growth ETF
BEPR.TO,Brompton Flaherty & Crumrine Enhanced Investment Grade Preferred ETF
BPRF.TO,Brompton Flaherty & Crumrine Investment Grade Preferred ETF
BDIV.TO,Brompton Global Dividend Growth ETF
HIG.TO,Brompton Global Healthcare Income & Growth ETF
LCS.TO,Brompton Lifeco Split Corp.
BFIN.TO,Brompton North American Financials Dividend ETF
BLOV.TO,Brompton North American Low Volatility Dividend ETF
SBC.TO,Brompton Split Banc Corp.
SPLT.TO,Brompton Split Corp. Preferred Share ETF
BREA.TO,Brompton Sustainable Real Assets Dividend ETF
TLF.TO,Brompton Tech Leaders Income ETF
BAM.TO,Brookfield Asset Management Ltd.
BBUC.TO,Brookfield Business Corporation
BN.TO,Brookfield Corporation
BIPC.TO,Brookfield Infrastructure Corporation
BNRE.TO,Brookfield Reinsurance Ltd.
BEPC.TO,Brookfield Renewable Corporation
DOO.TO,BRP Inc.
BUI.TO,Buhler Industries Inc.
BU.TO,Burcon Nutrascience Corporation
CAE.TO,CAE Inc.
CWL.TO,Caldwell Partners International Inc. (The)
UDA.TO,Caldwell U.S. Dividend Advantage Fund
CFW.TO,Calfrac Well Services Ltd.
CGY.TO,Calian Group Ltd.
CXB.TO,Calibre Mining Corp.
CCO.TO,Cameco Corporation
CF.TO,Canaccord Genuity Group Inc.
CNE.TO,Canacol Energy Ltd.
GOOS.TO,Canada Goose Holdings Inc.
BK.TO,Canadian Banc Corp.
CGI.TO,"Canadian General Investments, Limited"
CM.TO,Canadian Imperial Bank Of Commerce
NPS.TO,Canadian Large Cap Leaders Split Corp.
LFE.TO,Canadian Life Companies Split Corp.
CNR.TO,Canadian National Railway Company
CNQ.TO,Canadian Natural Resources Limited
CP.TO,Canadian Pacific Kansas City Limited
CTC.TO,"Canadian Tire Corporation, Limited"
CU.TO,Canadian Utilities Limited
CWB.TO,Canadian Western Bank
CCM.TO,Canagold Resources Ltd.
CFP.TO,Canfor Corporation
CFX.TO,Canfor Pulp Products Inc.
ICE.TO,Canlan Ice Sports Corp.
WEED.TO,Canopy Growth Corporation
CPX.TO,Capital Power Corporation
CS.TO,Capstone Copper Corp.
CJ.TO,Cardinal Energy Ltd.
CRDL.TO,Cardiol Therapeutics Inc.
CRRX.TO,CareRx Corporation
CJT.TO,Cargojet Inc.
CAS.TO,Cascades Inc.
CET.TO,Cathedral Energy Services Ltd.
CLS.TO,Celestica Inc.
CVE.TO,Cenovus Energy Inc.
CEE.TO,Centamin plc
CG.TO,Centerra Gold Inc.
CNT.TO,Century Global Commodities Corporation
CRP.TO,Ceres Global Ag Corp.
CEU.TO,CES Energy Solutions Corp.
CIA.TO,Champion Iron Limited
CWEB.TO,"Charlotte's Web Holdings, Inc."
CHW.TO,Chesswood Group Limited
CGG.TO,China Gold International Resources Corp. Ltd.
CHR.TO,Chorus Aviation Inc.
BXF.TO,CI 1-5 Year Laddered Government Strip Bond Index ETF
CMDO.TO,CI Alternative Diversified Opportunities Fund
CRED.TO,CI Alternative Investment Grade Credit Fund
CNAO.TO,CI Alternative North American Opportunities Fund
CCOM.TO,CI Auspice Broad Commodity Fund
CBAL.TO,CI Balanced Asset Allocation ETF
CBGR.TO,CI Balanced Growth Asset Allocation ETF
CBIN.TO,CI Balanced Income Asset Allocation ETF
CDNA.TO,CI Bio-Revolution Index ETF
CIC.TO,CI Canadian Banks Covered Call Income Class ETF
CXF.TO,CI Canadian Convertible Bond ETF
RIT.TO,CI Canadian REIT ETF
CCNV.TO,CI Conservative Asset Allocation ETF
CBUG.TO,CI Digital Security Index ETF
CCOR.TO,CI DoubleLine Core Plus Fixed Income US$ Fund
CINC.TO,CI DoubleLine Income US$ Fund
CDLB.TO,CI DoubleLine Total Return Bond US$ Fund
CIEM.TO,CI Emerging Markets Alpha ETF
NXF.TO,CI Energy Giants Covered Call ETF
FGO.TO,CI Enhanced Government Bond ETF
FSB.TO,CI Enhanced Short Duration Bond Fund
CEQT.TO,CI Equity Asset Allocation ETF
CIX.TO,CI Financial Corp.
CFRT.TO,CI Floating Rate Income Fund
CBCX.TO,CI Galaxy Blockchain Index ETF
CMVX.TO,CI Galaxy Metaverse Index ETF
CINV.TO,CI Global Alpha Innovation ETF
CGAA.TO,CI Global Asset Allocation Private Pool
CLML.TO,CI Global Climate Leaders Fund
FSF.TO,CI Global Financial Sector ETF
CGRB.TO,CI Global Green Bond Fund
CGHY.TO,CI Global High Yield Credit Private Pool
CINF.TO,CI Global Infrastructure Private Pool
CGIN.TO,CI Global Investment Grade ETF
LONG.TO,CI Global Longevity Economy Fund
CGDV.TO,CI Global Minimum Downside Volatility Index ETF
CGRA.TO,CI Global Real Asset Private Pool
CGRE.TO,CI Global REIT Private Pool
CGRN.TO,CI Global Sustainable Infrastructure Fund
VALT.TO,CI Gold Bullion Fund
CGXF.TO,CI Gold+ Giants Covered Call ETF
CGRO.TO,CI Growth Asset Allocation ETF
FHI.TO,CI Health Care Giants Covered Call ETF
CSAV.TO,CI High Interest Savings ETF
FIG.TO,CI Investment Grade Bond ETF
CMAR.TO,CI Marret Alternative Absolute Return Bond Fund
CMEY.TO,CI Marret Alternative Enhanced Yield Fund
CMNY.TO,CI Money Market ETF
WXM.TO,CI Morningstar Canada Momentum Index ETF
FXM.TO,CI Morningstar Canada Value Index ETF
ZXM.TO,CI Morningstar International Momentum Index ETF
VXM.TO,CI Morningstar International Value Index ETF
QXM.TO,CI Morningstar National Bank Québec Index ETF
YXM.TO,CI Morningstar US Momentum Index ETF
XXM.TO,CI Morningstar US Value Index ETF
FQC.TO,CI MSCI Canada Quality Index Class ETF
CMAG.TO,CI Munro Alternative Global Growth Fund
CMGG.TO,CI Munro Global Growth Equity Fund
ONEQ.TO,CI ONE Global Equity ETF
ONEB.TO,CI ONE North American Core Plus Bond ETF
FPR.TO,CI Preferred Share ETF
FGB.TO,CI Short Term Government Bond Index Class ETF
TXF.TO,CI Tech Giants Covered Call ETF
FLI.TO,CI U.S. & Canada Lifeco Covered Call ETF
CMOM.TO,CI U.S. Enhanced Momentum Index ETF
CVLU.TO,CI U.S. Enhanced Value Index ETF
CUDV.TO,CI U.S. Minimum Downside Volatility Index ETF
SID.TO,CI U.S. Trendleaders Index ETF
CUTL.TO,CI Utilities Giants Covered Call ETF
DGRC.TO,CI WisdomTree Canada Quality Dividend Growth Index ETF
EHE.TO,CI WisdomTree Europe Hedged Equity Index ETF
IQD.TO,CI WisdomTree International Quality Dividend Growth Index ETF
DQI.TO,CI WisdomTree International Quality Dividend Growth Variably Hedged Index ETF
JAPN.TO,CI WisdomTree Japan Equity Index ETF
UMI.TO,CI WisdomTree U.S. MidCap Dividend Index ETF
DGR.TO,CI WisdomTree U.S. Quality Dividend Growth Index ETF
DQD.TO,CI WisdomTree U.S. Quality Dividend Growth Variably Hedged Index ETF
CAGG.TO,CI Yield Enhanced Canada Aggregate Bond Index ETF
CAGS.TO,CI Yield Enhanced Canada Short-Term Aggregate Bond Index ETF
CACB.TO,CIBC Active Investment Grade Corporate Bond ETF
CAFR.TO,CIBC Active Investment Grade Floating Rate Bond ETF
CCBI.TO,CIBC Canadian Bond Index ETF
CCEI.TO,CIBC Canadian Equity Index ETF
CSBI.TO,CIBC Canadian Short-Term Bond Index ETF
CCNS.TO,CIBC Conservative Fixed Income Pool
CCRE.TO,CIBC Core Fixed Income Pool
CPLS.TO,CIBC Core Plus Fixed Income Pool
CEMI.TO,CIBC Emerging Markets Equity Index ETF
CFLX.TO,CIBC Flexible Yield ETF (CAD-Hedged)
CGBI.TO,CIBC Global Bond ex-Canada Index ETF (CAD-Hedged)
CGLO.TO,CIBC Global Growth ETF
CINT.TO,CIBC International Equity ETF
CIEI.TO,CIBC International Equity Index ETF
CIEH.TO,CIBC International Equity Index ETF (CAD-Hedged)
CUEI.TO,CIBC U.S. Equity Index ETF
CUEH.TO,CIBC U.S. Equity Index ETF (CAD-Hedged)
CGX.TO,Cineplex Inc.
CPH.TO,Cipher Pharmaceuticals Inc.
CVG.TO,Clairvest Group Inc.
CKI.TO,Clarke Inc.
CCA.TO,Cogeco Communications Inc.
CGO.TO,Cogeco Inc.
GCL.TO,Colabor Group Inc.
CNL.TO,Collective Mining Ltd.
CIGI.TO,Colliers International Group Inc.
YCM.TO,Commerce Split Corp.
CMG.TO,Computer Modelling Group Ltd.
CDR.TO,Condor Energies Inc.
COG.TO,Condor Gold plc
CFF.TO,Conifex Timber Inc.
CSU.TO,Constellation Software Inc.
CTS.TO,Converge Technology Solutions Corp.
CPLF.TO,Copperleaf Technologies Inc.
CVO.TO,Coveo Solutions Inc.
CPG.TO,Crescent Point Energy Corp.
CTX.TO,Crescita Therapeutics Inc.
CR.TO,Crew Energy Inc.
CRON.TO,Cronos Group Inc.
CRWN.TO,Crown Capital Partners Inc.
CURA.TO,"Curaleaf Holdings, Inc."
CXI.TO,"Currency Exchange International, Corp."
CYB.TO,Cymbria Corporation
DBO.TO,D-Box Technologies Inc.
DTOL.TO,D2L Inc.
DCM.TO,Data Communications Management Corp.
DAY.TO,"Dayforce, Inc."
DFY.TO,Definity Financial Corporation
DN.TO,Delta 9 Cannabis Inc.
DML.TO,Denison Mines Corp.
DNTL.TO,dentalcorp Holdings Ltd.
DSG.TO,Descartes Systems Group Inc. (The)
DCC.TO,Desjardins 1-5 year Laddered Canadian Corporate Bond Index ETF
DCG.TO,Desjardins 1-5 year Laddered Canadian Government Bond Index ETF
DANC.TO,Desjardins Alt Long/Short Equity Market Neutral ETF
DAMG.TO,Desjardins Alt Long/Short Global Equity Markets ETF
DCP.TO,Desjardins Canadian Preferred Share Index ETF
DCS.TO,Desjardins Canadian Short Term Bond Index ETF
DCU.TO,Desjardins Canadian Universe Bond Index ETF
DRCU.TO,Desjardins RI Active Canadian Bond - Net-Zero Emissions Pathway ETF
DRMC.TO,Desjardins RI Canada - Net-Zero Emissions Pathway ETF
DRFC.TO,Desjardins RI Canada Multifactor - Net-Zero Emissions Pathway ETF
DRMD.TO,Desjardins RI Developed ex-USA ex-Canada - Net-Zero Emissions Pathway ETF
DRME.TO,Desjardins RI Emerging Markets - Net-Zero Emissions Pathway ETF
DRFE.TO,Desjardins RI Emerging Markets Multifactor - Net-Zero Emissions Pathway ETF
DRFG.TO,Desjardins RI Global Multifactor - Fossil Fuel Reserves Free ETF
DRMU.TO,Desjardins RI USA - Net-Zero Emissions Pathway ETF
DRFU.TO,Desjardins RI USA Multifactor - Net-Zero Emissions Pathway ETF
DSAE.TO,Desjardins SocieTerra American Equity ETF
DRFD.TO,DesjardinsRIDeveloped ex-USAex-Canada Multifactor-Net-ZeroEmissionsPathwayETF
DXT.TO,Dexterra Group Inc.
DRT.TO,DIRTT Environmental Solutions Ltd.
DSV.TO,Discovery Silver Corp.
DIV.TO,Diversified Royalty Corp.
DFN.TO,Dividend 15 Split Corp.
DF.TO,Dividend 15 Split Corp. II
DGS.TO,Dividend Growth Split Corp.
DS.TO,Dividend Select 15 Corp.
DCBO.TO,Docebo Inc.
DOL.TO,Dollarama Inc.
DBM.TO,Doman Building Materials Group Ltd.
DLCG.TO,Dominion Lending Centres Inc.
DRM.TO,DREAM Unlimited Corp.
DPM.TO,Dundee Precious Metals Inc.
DND.TO,Dye & Durham Limited
DYA.TO,dynaCERT Inc.
DNG.TO,Dynacor Group Inc.
DXBC.TO,Dynamic Active Canadian Bond ETF
DXC.TO,Dynamic Active Canadian Dividend ETF
DXO.TO,Dynamic Active Crossover Bond ETF
DXDB.TO,Dynamic Active Discount Bond ETF
DXEM.TO,Dynamic Active Emerging Markets ETF
DXET.TO,Dynamic Active Energy Evolution ETF
DXQ.TO,Dynamic Active Enhanced Yield Covered Options ETF
DXG.TO,Dynamic Active Global Dividend ETF
DXGE.TO,Dynamic Active Global Equity Income ETF
DXF.TO,Dynamic Active Global Financial Services ETF
DXN.TO,Dynamic Active Global Infrastructure ETF
DXW.TO,Dynamic Active International Dividend ETF
DXIF.TO,Dynamic Active International ETF
DXV.TO,Dynamic Active Investment Grade Floating Rate ETF
DXP.TO,Dynamic Active Preferred Shares ETF
DXR.TO,Dynamic Active Retirement Income ETF
DXB.TO,Dynamic Active Tactical Bond ETF
DXU.TO,Dynamic Active U.S. Dividend ETF
DXUS.TO,Dynamic Active U.S. Equity ETF
DXBU.TO,Dynamic Active U.S. Investment Grade Corporate Bond ETF
DXZ.TO,Dynamic Active U.S. Mid-Cap ETF
ENS.TO,E Split Corp.
ELF.TO,E-L Financial Corporation Limited
EAGR.TO,East Side Games Group Inc.
ELR.TO,Eastern Platinum Limited
ECN.TO,ECN Capital Corp.
EVT.TO,Economic Investment Trust Limited
ECOR.TO,Ecora Resources plc
ECO.TO,EcoSynthetix Inc.
ELD.TO,Eldorado Gold Corporation
ELVA.TO,Electrovaya Inc.
EFN.TO,Element Fleet Management Corp.
ELO.TO,Eloro Resources Ltd.
BABY.TO,Else Nutrition Holdings Inc.
EMA.TO,Emera Incorporated
ENB.TO,Enbridge Inc.
EDV.TO,Endeavour Mining plc
EDR.TO,Endeavour Silver Corp.
EFX.TO,Enerflex Ltd.
EFR.TO,Energy Fuels Inc.
ERF.TO,Enerplus Corporation
ENGH.TO,Enghouse Systems Limited
ESI.TO,Ensign Energy Services Inc.
E.TO,"Enterprise Group, Inc."
EGLX.TO,Enthusiast Gaming Holdings Inc.
ETG.TO,Entree Resources Ltd.
EQB.TO,EQB Inc.
EQX.TO,Equinox Gold Corp.
ERD.TO,Erdene Resource Development Corporation
ERO.TO,Ero Copper Corp.
ETHR.TO,Ether ETF
EPRX.TO,Eupraxia Pharmaceuticals Inc.
ESM.TO,Euro Sun Mining Inc.
ET.TO,Evertz Technologies Limited
DIVS.TO,Evolve Active Canadian Preferred Share Fund
EARN.TO,Evolve Active Global Fixed Income Fund
CARS.TO,Evolve Automobile Innovation Index Fund
BANK.TO,Evolve Canadian Banks and Lifecos Enhanced Yield Index Fund
DATA.TO,Evolve Cloud Computing Index Fund
ETC.TO,Evolve Cryptocurrencies ETF
CYBR.TO,Evolve Cyber Security Index Fund
HERO.TO,Evolve E-Gaming Index ETF
BOND.TO,Evolve Enhanced Yield Bond Fund
EBNK.TO,Evolve European Banks Enhanced Yield ETF
TECH.TO,Evolve FANGMA Index ETF
LEAD.TO,Evolve Future Leadership Fund
LIFE.TO,Evolve Global Healthcare Enhanced Yield Fund
BASE.TO,Evolve Global Materials & Mining Enhanced Yield Index ETF
EDGE.TO,Evolve Innovation Index Fund
MESH.TO,Evolve Metaverse ETF
QQQY.TO,Evolve NASDAQ Technology Enhanced Yield Index Fund
QQQT.TO,Evolve NASDAQ Technology Index Fund
ESPX.TO,Evolve S&P 500® Enhanced Yield Fund
ETSX.TO,Evolve S&P/TSX 60 Enhanced Yield Fund
CALL.TO,Evolve US Banks Enhanced Yield Fund
EXN.TO,Excellon Resources Inc.
MIN.TO,Excelsior Mining Corp.
EIF.TO,Exchange Income Corporation
XTC.TO,Exco Technologies Limited
EGIF.TO,Exemplar Growth and Income Fund
EXRO.TO,Exro Technologies Inc.
EXE.TO,Extendicare Inc.
FFH.TO,Fairfax Financial Holdings Limited
FANS.TO,FansUnite Entertainment Inc.
FDY.TO,Faraday Copper Corp.
FDGE.TO,Farmers Edge Inc.
FRX.TO,Fennec Pharmaceuticals Inc.
FBTC.TO,Fidelity Advantage Bitcoin ETF
FETH.TO,Fidelity Advantage Ether ETF
FCCD.TO,Fidelity Canadian High Dividend ETF
FCCQ.TO,Fidelity Canadian High Quality ETF
FCCL.TO,Fidelity Canadian Low Volatility ETF
FCCM.TO,Fidelity Canadian Momentum ETF
FCMI.TO,Fidelity Canadian Monthly High Income ETF
FCSB.TO,Fidelity Canadian Short Term Corporate Bond ETF
FCCV.TO,Fidelity Canadian Value ETF
FCGB.TO,Fidelity Global Core Plus Bond ETF
FCIG.TO,Fidelity Global Investment Grade Bond ETF
FCGI.TO,Fidelity Global Monthly High Income ETF
FCID.TO,Fidelity International High Dividend ETF
FCIQ.TO,Fidelity International High Quality ETF
FCIL.TO,Fidelity International Low Volatility ETF
FCIM.TO,Fidelity International Momentum ETF
FCIV.TO,Fidelity International Value ETF
FCCB.TO,Fidelity Systematic Canadian Bond Index ETF
FCRH.TO,Fidelity U.S. Dividend for Rising Rates Currency Neutral ETF
FCRR.TO,Fidelity U.S. Dividend for Rising Rates ETF
FCUH.TO,Fidelity U.S. High Dividend Currency Neutral ETF
FCUD.TO,Fidelity U.S. High Dividend ETF
FCQH.TO,Fidelity U.S. High Quality Currency Neutral ETF
FCUQ.TO,Fidelity U.S. High Quality ETF
FCLH.TO,Fidelity U.S. Low Volatility Currency Neutral ETF
FCUL.TO,Fidelity U.S. Low Volatility ETF
FCMH.TO,Fidelity U.S. Momentum Currency Neutral ETF
FCMO.TO,Fidelity U.S. Momentum ETF
FCVH.TO,Fidelity U.S. Value Currency Neutral ETF
FCUV.TO,Fidelity U.S. Value ETF
FSZ.TO,Fiera Capital Corporation
FIL.TO,Filo Corp
